<?xml version="1.0"?>
<!DOCTYPE profile PUBLIC "" "/etc/v3m/v3m_profile.dtd">
<profile>
	<name>QEMUTest</name>
	<type>Qemu</type>
	<image size="1000">./qemu_test.img</image>
    <cdrom>../contrib/bin/oscar_bootcd.iso</cdrom>
	<nic1>
		<type>TUN/TAP</type>
		<mac>00:02:c3:c4:c5:c6</mac>
	</nic1>
	<nic2>
		<type>VLAN</type>
		<mac>00:02:c3:04:b1:aa</mac>
	</nic2>
</profile>
